centre_type,abn,name,phone,suburb,description
Hospital,1111,Sydney Children Hospital,93821111,Randwick,Australian children's hospital located in the eastern suburbs of Sydney
MedicalCentre,1112,UNSW Health Service,93855425,Kensington,University health service at UNSW
Hospital,1113,Prince of Wales Hospital,93821118,Randwick,440 bed major public teaching hospital located in Sydney's eastern suburb of Randwick
Hospital,1114,Royal Prince Alfred Hospital,95156111,Sydney,Major public teaching hospital in Sydney, Australia
MedicalCentre,1115,USYD Health Service,93513484,Darlington,University health service at USYD
MedicalCentre,1116,UTS Health Service,95141177,Ultimo,University health service at UTS
